{
  "compiler_status": "NOT_EXECUTED",
  "fuzz_status": "NOT_EXECUTED",
  "generation_timestamp": "2026-07-25T19:31:08Z",
  "integration_status": "NOT_EXECUTED",
  "live_repository_status": "NOT_INCLUDED",
  "pack_name": "AIOM_SENTINEL_RULE_COMPILER_AUTOLOADER_CANONICAL_BASIS_v1.1",
  "pack_version": "1.1",
  "safe_to_merge": false,
  "test_status": "NOT_EXECUTED",
  "verifier_status": "NOT_EXECUTED"
}
